### ISSUE TITLE
[Bug]: sp_describe_undeclared_parameters breaks transaction on failure

### ISSUE THREAD

**Issue by staticlibs** [babelfish-for-postgresql/babelfish_extensions#1354]
### What happened?

[PyODBC](https://github.com/mkleehammer/pyodbc) uses `SQLDescribeParam` [ODBC call](https://learn.microsoft.com/en-us/sql/odbc/reference/syntax/sqldescribeparam-function?view=sql-server-ver16) to get the type of the parameter when `None` is specified as a parameter value ([details](https://github.com/mkleehammer/pyodbc/blob/4829107c39fdd066b3d86ed6c226fb933b712eba/src/params.cpp#L2083)). `SQLDescribeParam` calls `sp_describe_undeclared_parameters` stored procedure. These calls are done on a "best effort" basis, it is not always possible for MSSQL/Babelfsh to derive the correct parameter type based on the query text. PyODBC expects possible failure of `SQLDescribeParam` and [handles it gracefully](https://github.com/mkleehammer/pyodbc/blob/4829107c39fdd066b3d86ed6c226fb933b712eba/src/params.cpp#L2124). The problem is that the transactional behaviour after `sp_describe_undeclared_parameters` is different with Babelfsh comparing to MSSQL.

Consider the following example:

```
import pyodbc
conn = pyodbc.connect("DRIVER={ODBC Driver 18 for SQL Server};...")
cursor = conn.cursor();
cursor.execute("select ?", [None]);
records = cursor.fetchall();
print(records[0][0])
# do some inserts/updates
conn.commit()
print("success")
```

In this case `sp_describe_undeclared_parameters` will fail for both MSSQL an Babelfish. Just with MSSQL the commit call on the same connection is handled correctly, MSSQL output:

```
$ python test.py 
None
success
```

But Babelfish, while it returns the query resulting data correctly, it does not allow to perform commit on the same connection, its output:

```
$ python test.py 
None
Traceback (most recent call last):
  File "/home/alex/[...]/test.py", line 11, in <module>
    conn.commit()
pyodbc.ProgrammingError: ('25000', '[25000] [Microsoft][ODBC Driver 18 for SQL Server][SQL Server]COMMIT can only be used in transaction blocks (3902) (SQLEndTran)')
```

Please note, that the problem is not that this is an `Unsupported use case in sp_describe_undeclared_parameters` (the example above is also unsupported in MSSQL), but in the transactional behaviour after the `sp_describe_undeclared_parameters` failure.

Besides that, PyODBC gives little flexibility to work with transactions ([docs](https://github.com/mkleehammer/pyodbc/wiki/Objects#commit)), excluding `autocommit` mode, the transaction is always started when the connection is opened. While `connection.commit()` is called explicitly from python code, after the select query is run (and its correct data is returned) there is no information on Python level whether `sp_describe_undeclared_parameters` failure happened or not (because the failure is handled inside PyODBC) and it is not known whether `commit()` can be called on this connection or not.

It breaks the Python application, where there are many queries like the following (with `None`s used for parameters not supplied by end users):

```
select * from tbl1
where
((? is null) or (id = ?))
and 
((? is null) or (name = ?))
...
```

As I understand (please correct me if I am wrong), it is not possible to change the `sp_describe_undeclared_parameters` behaviour by changing its `plpgsql` definition. And patching `procedures.c` is not an option for us because we'd like to use AWS Babelfish on Aurora.

As a workaround we are currently using a locally patched version of PyODBC (with `SQLDescribeParam` patched out), comments on any other possible workarounds are highly appreciated.

### Version

BABEL_3_X_DEV (Default)

### Extension

babelfishpg_tsql (Default)

### Which flavor of Linux are you using when you see the bug?

Fedora

### Relevant log output

```shell
2023-03-21 13:38:21.341 GMT [28197] LOG:  Unmapped error found. Code: 1088, Message: Unsupported use case in sp_describe_undeclared_parameters, File: procedures.c, Line: 1031, Context: babelfishpg_tsql
2023-03-21 13:38:21.341 GMT [28197] CONTEXT:  PL/tsql function sp_describe_undeclared_parameters(nvarchar,nvarchar) line 3 at SQL statement
	SQL statement "EXEC sp_describe_undeclared_parameters @p1"
	PL/tsql function inline_code_block line 1 at EXEC
	TDS Protocol: Message Type: RPC, SP Type: SP_CUSTOMTYPE, Phase: TDS_REQUEST_PHASE_PROCESS. Preparing to Send Back the Tds response
2023-03-21 13:38:21.341 GMT [28197] LOG:  Unmapped error found. Code: 1088, Message: Unsupported use case in sp_describe_undeclared_parameters, File: procedures.c, Line: 1031, Context: babelfishpg_tsql
2023-03-21 13:38:21.341 GMT [28197] CONTEXT:  SQL statement "EXEC sp_describe_undeclared_parameters @p1"
	PL/tsql function inline_code_block line 1 at EXEC
	TDS Protocol: Message Type: RPC, SP Type: SP_CUSTOMTYPE, Phase: TDS_REQUEST_PHASE_PROCESS. Preparing to Send Back the Tds response
2023-03-21 13:38:21.341 GMT [28197] LOG:  Unmapped error found. Code: 1088, Message: Unsupported use case in sp_describe_undeclared_parameters, File: procedures.c, Line: 1031, Context: babelfishpg_tsql
2023-03-21 13:38:21.341 GMT [28197] CONTEXT:  PL/tsql function inline_code_block line 1 at EXEC
	TDS Protocol: Message Type: RPC, SP Type: SP_CUSTOMTYPE, Phase: TDS_REQUEST_PHASE_PROCESS. Preparing to Send Back the Tds response
2023-03-21 13:38:21.341 GMT [28197] LOG:  Unmapped error found. Code: 1088, Message: Unsupported use case in sp_describe_undeclared_parameters, File: procedures.c, Line: 1031, Context: babelfishpg_tsql
2023-03-21 13:38:21.341 GMT [28197] CONTEXT:  TDS Protocol: Message Type: RPC, SP Type: SP_CUSTOMTYPE, Phase: TDS_REQUEST_PHASE_PROCESS. Preparing to Send Back the Tds response
2023-03-21 13:38:21.341 GMT [28197] ERROR:  Unsupported use case in sp_describe_undeclared_parameters
2023-03-21 13:38:21.341 GMT [28197] CONTEXT:  PL/tsql function sp_describe_undeclared_parameters(nvarchar,nvarchar) line 3 at SQL statement
	SQL statement "EXEC sp_describe_undeclared_parameters @p1"
	PL/tsql function inline_code_block line 1 at EXEC
	TDS Protocol: Message Type: RPC, SP Type: SP_CUSTOMTYPE, Phase: TDS_REQUEST_PHASE_PROCESS. Preparing to Send Back the Tds response
2023-03-21 13:38:21.341 GMT [28197] LOG:  Unmapped error found. Code: 1088, Message: Unsupported use case in sp_describe_undeclared_parameters, File: procedures.c, Line: 1031, Context: TDS
2023-03-21 13:38:21.341 GMT [28197] CONTEXT:  TDS Protocol: Message Type: RPC, SP Type: SP_CUSTOMTYPE, Phase: TDS_REQUEST_PHASE_PROCESS. Preparing to Send Back the Tds response
2023-03-21 13:38:21.342 GMT [28197] LOG:  message_type: Remote Procedure Call (3) rpc_packet_type: sp_prepexec
2023-03-21 13:38:21.342 GMT [28197] CONTEXT:  TDS Protocol: Message Type: RPC, SP Type: SP_PREPEXEC, Phase: TDS_REQUEST_PHASE_FETCH. Fetching RPC Request
2023-03-21 13:38:21.342 GMT [28197] LOG:  sp_prepexec handle: 0, statement: select @P1
2023-03-21 13:38:21.342 GMT [28197] DETAIL:  Parameters: $1 = NULL
2023-03-21 13:38:21.343 GMT [28197] LOG:  message_type: Transaction Management Request (14) txn_request_type: TM_COMMIT_XACT
2023-03-21 13:38:21.343 GMT [28197] CONTEXT:  TDS Protocol: Message Type: Txn Manager, Txn Type: TM_COMMIT_XACT, Phase: TDS_REQUEST_PHASE_FETCH. Fetching Transaction Management Request
2023-03-21 13:38:21.376 GMT [28197] ERROR:  COMMIT can only be used in transaction blocks
2023-03-21 13:38:21.376 GMT [28197] CONTEXT:  SQL statement "COMMIT TRANSACTION ;"
	PL/tsql function inline_code_block line 1 at SQL statement
	TDS Protocol: Message Type: Txn Manager, Txn Type: TM_COMMIT_XACT, Phase: TDS_REQUEST_PHASE_PROCESS. Processing Transaction Management Request
2023-03-21 13:38:21.438 GMT [28197] LOG:  message_type: Remote Procedure Call (3) rpc_packet_type: sp_unprepare
2023-03-21 13:38:21.438 GMT [28197] CONTEXT:  TDS Protocol: Message Type: RPC, SP Type: SP_UNPREPARE, Phase: TDS_REQUEST_PHASE_FETCH. Fetching RPC Request
2023-03-21 13:38:21.438 GMT [28197] LOG:  could not receive data from client: Connection reset by peer
2023-03-21 13:38:21.438 GMT [28197] CONTEXT:  TDS Protocol: Message Type: RPC, SP Type: Unknown (Pre-Parsing Request), Phase: TDS_REQUEST_PHASE_FETCH. Reading data from socket
2023-03-21 13:38:21.438 GMT [28197] LOG:  EOF on TDS socket
2023-03-21 13:38:21.438 GMT [28197] CONTEXT:  TDS Protocol: EOF reached on TDS socket
```

### Code of Conduct

- [X] I agree to follow this project's Code of Conduct.

**Comment by kuntalghosh** [comment]
In MSSQL, when an error occurs inside a transaction, depending on the error code, it can either rollback the entire transaction or rollback that particular statement and continue in the same transaction.

In Babelfish, we're mainly dealing with PG error codes. It's not possible to map all the PG error codes to equivalent MSSQL error codes (more than a few thousands). So, we tried our best to implement a few of the error [codes](https://github.com/babelfish-for-postgresql/babelfish_extensions/blob/BABEL_3_X_DEV/contrib/babelfishpg_tds/error_mapping.txt). For the rest, you'll see the following debug log
`2023-03-21 13:38:21.341 GMT [28197] LOG:  Unmapped error found. Code: <>, Message: <>`

The Babelfish behaviour is if an unmapped error occurs inside a transaction, the entire transaction is rolled back.

To fix this particular issue, it'll be good if you can share the exact T-SQL error code. Then, we can add an explicit mapping for this <error code + error message>->T-SQL error code and allow execution after the error.

**Comment by staticlibs** [comment]
T-SQL error code from MSSQL in this case is `11506`, and TDS request and response for the `sp_describe_undeclared_parameters` call is the following:
```
No.     Time           Source                Destination           Protocol Length Info
     24 0.026818938    127.0.0.1             127.0.0.1             TDS      212    Remote Procedure Call

Frame 24: 212 bytes on wire (1696 bits), 212 bytes captured (1696 bits) on interface lo, id 0
Ethernet II, Src: 00:00:00_00:00:00 (00:00:00:00:00:00), Dst: 00:00:00_00:00:00 (00:00:00:00:00:00)
Internet Protocol Version 4, Src: 127.0.0.1, Dst: 127.0.0.1
Transmission Control Protocol, Src Port: 53159, Dst Port: 1433, Seq: 1331, Ack: 5886, Len: 146
Tabular Data Stream
    Type: Remote Procedure Call (3)
    Status: 0x01, End of message
    Length: 146
    Channel: 0
    Packet Number: 1
    Window: 0
    Remote Procedure Call
        Packet data stream headers
            Total length: 22
            Header
                Length: 18
                Type: Transaction descriptor (0x0002)
                Transaction descriptor: 270582939649
                Outstanding request count: 1
        Procedure name length: 33
        Procedure name: sp_describe_undeclared_parameters
        Option flags: 0x0000
            .... .... .... ...0 = With recompile: False
            .... .... .... ..0. = No metadata: False
            .... .... .... .0.. = Reuse metadata: False
        Parameter
            Name length: 0
            Status flags: 0x00
            Type info (NVARCHARTYPE - NVarChar)
            Value (select @P1)

No.     Time           Source                Destination           Protocol Length Info
     25 0.027646951    127.0.0.1             127.0.0.1             TDS      339    Response

Frame 25: 339 bytes on wire (2712 bits), 339 bytes captured (2712 bits) on interface lo, id 0
Ethernet II, Src: 00:00:00_00:00:00 (00:00:00:00:00:00), Dst: 00:00:00_00:00:00 (00:00:00:00:00:00)
Internet Protocol Version 4, Src: 127.0.0.1, Dst: 127.0.0.1
Transmission Control Protocol, Src Port: 1433, Dst Port: 53159, Seq: 5886, Ack: 1477, Len: 273
Tabular Data Stream
    Type: Response (4)
    Status: 0x01, End of message
    Length: 273
    Channel: 63
    Packet Number: 1
    Window: 0
    Token - Error
        Token length: 244
        SQL Error Number: 11506
        State: 1
        Class (Severity): 16
        Error message length: 103 characters
        Error message: The parameter type for '@P1' cannot be uniquely deduced; two possibilities are 'sql_variant' and 'xml'.
        Server name length: 12 characters
        Server name: da369ada2efe
        Process name length: 0 characters
        Line number: 1
    Token - ReturnStatus
        Value: 1
    Token - DoneProc
        .... ...0 0000 0010 = Status flags: 0x002, Error
        Operation: 0x00e0
        Row count: 0

```

**Comment by tanscorpio7** [comment]
Same root cause as https://github.com/babelfish-for-postgresql/babelfish_extensions/issues/2379
Fixed in https://github.com/babelfish-for-postgresql/babelfish_extensions/pull/2444
